[
  {
    "source": "zimmo.be",
    "scraped_at": "2026-09-23T14:20:10.757167+00:00",
    "url": "https://www.zimmo.be/nl/gent-9000/te-koop/huis/LRZLA",
    "sku": "LRZLA",
    "title": "Huis te koop",
    "brand": null,
    "price": 210000.0,
    "currency": "EUR",
    "original_price": null,
    "discount_pct": null,
    "image_url": "https://files.zimmo.be/backend-api/qMbJs7nn9uXzLU5aLtWl6XQOLD0=/828x618/filters:image-format(pjpg)/-/real-estate/customers/b4e045de-4bae-11e9-922b-005056b768a1/dealers/d8334a31-1f5c-4c08-994d-b0a3d6a03f65/listings/52a68ae4-88dc-4c2a-8885-e215155beb7a/images/01a0ce69-9587-7761-9b6a-30c604f1d540",
    "category": "gent-koop",
    "listing_type": "sale",
    "property_type": "huis",
    "location": "Zwijnaardsesteenweg 685 9000 Gent",
    "surface_m2": null,
    "bedrooms": 3,
    "epc_label": "F",
    "epc_value": null
  },
  {
    "source": "zimmo.be",
    "scraped_at": "2026-09-23T14:20:10.758284+00:00",
    "url": "https://www.zimmo.be/nl/gent-9000/te-koop/appartement/LRZKI",
    "sku": "LRZKI",
    "title": "Appartement te koop",
    "brand": null,
    "price": 355000.0,
    "currency": "EUR",
    "original_price": null,
    "discount_pct": null,
    "image_url": "https://files.zimmo.be/backend-api/uoqMARL1lhm7fEW59A_yJjriSMI=/828x618/filters:image-format(pjpg)/-/real-estate/customers/b4d8c4bb-4bae-11e9-922b-005056b768a1/dealers/fb916d12-f387-49cb-a7fa-e780853462f9/listings/46532567-5497-441f-80aa-8eb1f7e6686b/images/01a0ce5b-4186-7e8f-8530-fbdafba05c02",
    "category": "gent-koop",
    "listing_type": "sale",
    "property_type": "appartement",
    "location": "Martelaarslaan 287 9000 Gent",
    "surface_m2": 92.0,
    "bedrooms": 2,
    "epc_label": null,
    "epc_value": null
  },
  {
    "source": "zimmo.be",
    "scraped_at": "2026-09-23T14:20:10.759202+00:00",
    "url": "https://www.zimmo.be/nl/gent-9000/te-koop/huis/LRZI3",
    "sku": "LRZI3",
    "title": "Huis te koop",
    "brand": null,
    "price": 375000.0,
    "currency": "EUR",
    "original_price": null,
    "discount_pct": null,
    "image_url": "https://files.zimmo.be/backend-api/6BDLl8rwef18SbPF7CYoL2l0ESk=/828x618/filters:image-format(pjpg)/-/real-estate/customers/b4d737a1-4bae-11e9-922b-005056b768a1/dealers/b20d94f4-3775-4a99-aa04-37af24b6808c/listings/4dfa7b73-0a0b-4c6c-bad9-9dff385fdfaa/images/01a0ce29-9e37-7356-a42d-550d7b732d95",
    "category": "gent-koop",
    "listing_type": "sale",
    "property_type": "huis",
    "location": "Meibloemstraat 17 9000 Gent",
    "surface_m2": 185.0,
    "bedrooms": 4,
    "epc_label": "F",
    "epc_value": null
  },
  {
    "source": "zimmo.be",
    "scraped_at": "2026-09-23T14:20:10.760134+00:00",
    "url": "https://www.zimmo.be/nl/gent-9000/te-koop/huis/LRZC4",
    "sku": "LRZC4",
    "title": "Huis te koop",
    "brand": null,
    "price": 589000.0,
    "currency": "EUR",
    "original_price": null,
    "discount_pct": null,
    "image_url": "https://files.zimmo.be/backend-api/1R2aEQ_0Bx6n-DdGx16c-wGl26U=/828x618/filters:image-format(pjpg)/-/real-estate/customers/b4cf3a01-4bae-11e9-922b-005056b768a1/dealers/d90ca3af-38d5-4167-8864-cf7d134f45b8/listings/0500c0b8-3042-460b-a4fc-722f538274fe/images/01a0cdb0-368e-76a6-820d-b2abd2875ebf",
    "category": "gent-koop",
    "listing_type": "sale",
    "property_type": "huis",
    "location": "Noendries 87 9000 Gent",
    "surface_m2": 164.0,
    "bedrooms": 3,
    "epc_label": "A",
    "epc_value": null
  },
  {
    "source": "zimmo.be",
    "scraped_at": "2026-09-23T14:20:10.761108+00:00",
    "url": "https://www.zimmo.be/nl/gent-9000/te-koop/nieuwbouwproject/10057NM",
    "sku": "10057NM",
    "title": "Project",
    "brand": null,
    "price": 163750.0,
    "currency": "EUR",
    "original_price": null,
    "discount_pct": null,
    "image_url": "https://files.zimmo.be/backend-api/hZ-gPZ6JbIEWxPeMW_DTCLF4sHM=/828x618/filters:image-format(pjpg)/-/real-estate/customers/b4d8c4bb-4bae-11e9-922b-005056b768a1/dealers/fb916d12-f387-49cb-a7fa-e780853462f9/listings/d41b3ae4-0652-430b-9a90-2b539bd9928b/images/01a0c8f6-a6b8-7e40-bd0b-c189fabc4732",
    "category": "gent-koop",
    "listing_type": "sale",
    "property_type": "nieuwbouwproject",
    "location": "Gasmeterlaan 103 9000 Gent",
    "surface_m2": 16.0,
    "bedrooms": 1,
    "epc_label": null,
    "epc_value": null
  },
  {
    "source": "zimmo.be",
    "scraped_at": "2026-09-23T14:20:10.761851+00:00",
    "url": "https://www.zimmo.be/nl/gent-9000/te-koop/bedrijfsvastgoed/LRZ5F",
    "sku": "LRZ5F",
    "title": "Bedrijfsvastgoed te koop",
    "brand": null,
    "price": 140000.0,
    "currency": "EUR",
    "original_price": null,
    "discount_pct": null,
    "image_url": "https://files.zimmo.be/backend-api/96CH6x78VIw-je6ZfQTnGDs3ka4=/828x618/filters:image-format(pjpg)/-/real-estate/customers/b5030bb5-4bae-11e9-922b-005056b768a1/dealers/c0794025-6c1c-44fe-9c48-e8c3ab7715a0/listings/1387dd51-2eb7-4d83-a1b7-15801da12174/images/01a0cd60-14f5-73f3-9414-e74eebf9656f",
    "category": "gent-koop",
    "listing_type": "sale",
    "property_type": "bedrijfsvastgoed",
    "location": "Perzikstraat 51/53 9000 Gent",
    "surface_m2": 196.0,
    "bedrooms": null,
    "epc_label": null,
    "epc_value": null
  },
  {
    "source": "zimmo.be",
    "scraped_at": "2026-09-23T14:20:10.762707+00:00",
    "url": "https://www.zimmo.be/nl/gent-9000/te-koop/huis/LRZ52",
    "sku": "LRZ52",
    "title": "Huis te koop",
    "brand": null,
    "price": 330000.0,
    "currency": "EUR",
    "original_price": null,
    "discount_pct": null,
    "image_url": "https://files.zimmo.be/backend-api/7a4rzZWX0tEV53C5AqnOy0_ZWEQ=/828x618/filters:image-format(pjpg)/-/real-estate/customers/b4cfb3d5-4bae-11e9-922b-005056b768a1/dealers/4bdd167a-828c-4010-bdfb-a9ab45351cf0/listings/7cf79c0d-de5f-4b19-8b52-10b109e45355/images/01a0cd5d-787b-70e2-82ca-31add6139883",
    "category": "gent-koop",
    "listing_type": "sale",
    "property_type": "huis",
    "location": "Rietstraat 41 9000 Gent",
    "surface_m2": 114.0,
    "bedrooms": 2,
    "epc_label": "D",
    "epc_value": null
  },
  {
    "source": "zimmo.be",
    "scraped_at": "2026-09-23T14:20:10.763557+00:00",
    "url": "https://www.zimmo.be/nl/gent-9000/te-koop/huis/LRZ3I",
    "sku": "LRZ3I",
    "title": "Huis te koop",
    "brand": null,
    "price": 419000.0,
    "currency": "EUR",
    "original_price": null,
    "discount_pct": null,
    "image_url": "https://files.zimmo.be/backend-api/2VOsTAQaSKkJ3dT73ZliSjai8p4=/828x618/filters:image-format(pjpg)/-/real-estate/customers/b52a4014-4bae-11e9-922b-005056b768a1/dealers/63ed43c3-a22f-49c9-a5a8-72e57c6e5049/listings/a435375d-e0f2-422f-abf8-7ce4731b8393/images/01a0cd41-e803-75ca-8722-a6df39969613",
    "category": "gent-koop",
    "listing_type": "sale",
    "property_type": "huis",
    "location": "Brugsesteenweg 250 9000 Gent",
    "surface_m2": 146.0,
    "bedrooms": 3,
    "epc_label": "C",
    "epc_value": null
  },
  {
    "source": "zimmo.be",
    "scraped_at": "2026-09-23T14:20:10.764422+00:00",
    "url": "https://www.zimmo.be/nl/gent-9000/te-koop/huis/LRZ1B",
    "sku": "LRZ1B",
    "title": "Huis te koop",
    "brand": null,
    "price": 279000.0,
    "currency": "EUR",
    "original_price": null,
    "discount_pct": null,
    "image_url": "https://files.zimmo.be/backend-api/RSYCUoQvjQ_c-uRaFnjvA9Rdu3U=/828x618/filters:image-format(pjpg)/-/real-estate/customers/089e0cd0-5673-42cc-a27a-60c9b335f1e3/dealers/006287f3-7c89-4a13-85db-d9bf774f9af7/listings/c94b883b-939e-401d-973d-e6dc12594978/images/01a0cd04-3038-7b3b-b9a9-e1b83611c539",
    "category": "gent-koop",
    "listing_type": "sale",
    "property_type": "huis",
    "location": "Neringstraat 1 9000 Gent",
    "surface_m2": 88.0,
    "bedrooms": 3,
    "epc_label": "C",
    "epc_value": null
  },
  {
    "source": "zimmo.be",
    "scraped_at": "2026-09-23T14:20:10.765277+00:00",
    "url": "https://www.zimmo.be/nl/gent-9000/te-koop/huis/LRYYI",
    "sku": "LRYYI",
    "title": "Huis te koop",
    "brand": null,
    "price": 650000.0,
    "currency": "EUR",
    "original_price": null,
    "discount_pct": null,
    "image_url": "https://files.zimmo.be/backend-api/hOFawP8TIxrQr56eTQ8KtpzOG9A=/828x618/filters:image-format(pjpg)/-/real-estate/customers/b4cf82b6-4bae-11e9-922b-005056b768a1/dealers/34f36435-3d24-4865-809e-3381c8c238e6/listings/ec9bb71f-1fdf-4abb-80d9-1ae39e2720cd/images/01a0cbd7-3b5b-7256-a544-57e1012e95aa",
    "category": "gent-koop",
    "listing_type": "sale",
    "property_type": "huis",
    "location": "Mahatma Gandhistraat 5 9000 Gent",
    "surface_m2": 222.0,
    "bedrooms": 4,
    "epc_label": "C",
    "epc_value": null
  },
  {
    "source": "zimmo.be",
    "scraped_at": "2026-09-23T14:20:10.766239+00:00",
    "url": "https://www.zimmo.be/nl/gent-9000/te-koop/huis/LLEEA",
    "sku": "LLEEA",
    "title": "Huis te koop",
    "brand": null,
    "price": 249000.0,
    "currency": "EUR",
    "original_price": null,
    "discount_pct": null,
    "image_url": "https://files.zimmo.be/backend-api/_U3y_ISDKT_ZbkY32S2NOTKsfjo=/828x618/filters:image-format(pjpg)/-/real-estate/customers/b4d3d338-4bae-11e9-922b-005056b768a1/dealers/d1dc09ad-86f5-4991-a79c-f05c0729bfc7/listings/da2b2224-a211-46b2-a1b0-34fb13cb71de/images/019f6d6a-db47-7da9-b1a0-cedaf3d28c7c",
    "category": "gent-koop",
    "listing_type": "sale",
    "property_type": "huis",
    "location": "Liverpoolstraat 3 9000 Gent",
    "surface_m2": 155.0,
    "bedrooms": 4,
    "epc_label": "E",
    "epc_value": null
  },
  {
    "source": "zimmo.be",
    "scraped_at": "2026-09-23T14:20:10.767310+00:00",
    "url": "https://www.zimmo.be/nl/gent-9000/te-koop/huis/LQY1M",
    "sku": "LQY1M",
    "title": "Huis te koop",
    "brand": null,
    "price": 499000.0,
    "currency": "EUR",
    "original_price": null,
    "discount_pct": null,